### ISSUE TITLE
sFlow only?

### ISSUE THREAD

**Issue by barhom** [manuelkasper/AS-Stats#53]
Seems like my Juniper ex4550 does not support NetFlow.
I've successfully enabled sFlow and can see packets coming in via tcpdump on port 6343.

`root@vm100:/opt/AS-Stats/rrd# tcpdump -i eth1 port 6343 -n
tcpdump: verbose output suppressed, use -v or -vv for full protocol decode
listening on eth1, link-type EN10MB (Ethernet), capture size 262144 bytes
20:09:18.729260 IP 172.16.0.2.56580 > 172.16.0.1.6343: sFlowv5, IPv4 agent 172.16.0.2, agent-id 16, length 1260
20:09:18.800624 IP 172.16.0.2.56580 > 172.16.0.1.6343: sFlowv5, IPv4 agent 172.16.0.2, agent-id 16, length 1316
20:09:18.871397 IP 172.16.0.2.56580 > 172.16.0.1.6343: sFlowv5, IPv4 agent 172.16.0.2, agent-id 16, length 1372
20:09:18.952754 IP 172.16.0.2.56580 > 172.16.0.1.6343: sFlowv5, IPv4 agent 172.16.0.2, agent-id 16, length 1420
20:09:19.030568 IP 172.16.0.2.56580 > 172.16.0.1.6343: sFlowv5, IPv4 agent 172.16.0.2, agent-id 16, length 1372`

The sFlow packets are coming from 172.16.0.2.
What do I need to put in knownlinks ?

I ran this
`./asstatd.pl -r ../rrd/ -k ../conf/knownlinks -p 0 -a 62020`

But it is not creating any rrd files and no debug to know if its receiving any sFlow packets or not

**Comment by JackSlateur** [comment]
You knownlinks must be filled with, per line, with tab separation (not space):
First, the sFlow agent's IP. This is not always to packet source IP.
Then, the ifindex of on interface you want to monitor, you may find that id somewhere, use snmpbulkwalk if you don't
Then, a random name, that will never change, as it's written on the rrd (if you have to add/remove such name, all rrds must be recreated)
Then, a random name, than can be changed anytime
Then, a color, using hex, like 0a4484 or ff5576
Last, the sampling rate, as configured on your hardware

**Comment by jordani0** [comment]
Hello Team, 

Same here, rrd files are not populated in rrd folder. Knownlinks file is filled with tabs not with space:
192.168.231.18  14      peeringx        IXPx    FDBF6F  1024
Also i can see sFlow coming via tcpdump.
executed:
/usr/bin/perl -w /opt/AS-Stats/bin/asstatd.pl -P 6343 -p 0 -a 55429 -r /opt/AS-Stats/rrd -k /opt/AS-Stats/conf/knownlinks
Where I can see logs or something that can be used for debug? 
Thanks in advance!

**Comment by jordani0** [comment]
Hello, 

Added that to startup script " -m /usr/share/perl5/tools/ip2asn.json "
and now is working.
